sigma_id,entry_type,meta_layer,domain,sub_domain,name_full,name_short,standard_id,issuer,issuer_type,governance_layer,geographic_scope,year_published,year_first,status,mandate,sector_applicability,why_it_matters,key_outputs,official_url,data_source,notes
EX-EITI-STANDARD-2023,Standard,Environment & Natural Systems,Extractive Industries & Natural Resources,Extractives transparency,EITI Standard,EITI Standard,EITI Standard 2023,Extractive Industries Transparency Initiative,NGO,International,Global,2023,2003,Active,Voluntary-with-regulatory-adoption,Governments and extractive companies,Global transparency standard for oil gas and mining governance,EITI Standard 2023,https://eiti.org/eiti-standard,EITI official standard page,Curated seed record for 40-domain coverage
EX-ICMM-PRINCIPLES-2023,Framework,Environment & Natural Systems,Extractive Industries & Natural Resources,Mining sustainability,ICMM Mining Principles,ICMM Principles,ICMM Principles 2023,International Council on Mining and Metals,Industry SDO,International,Global,2023,2003,Active,Voluntary-with-regulatory-adoption,Mining companies and investors,10 principles for sustainable mining practice,ICMM Mining Principles,https://www.icmm.com/our-work/mining-principles,ICMM principles page,Expanded from ICMM for critical domain coverage
EX-KIMBERLEY-2003,Framework,Environment & Natural Systems,Extractive Industries & Natural Resources,Conflict diamonds,Kimberley Process Certification Scheme,KPCS,Kimberley Process,Kimberley Process,Intergovernmental,International,Global,2003,2003,Active,Voluntary-with-regulatory-adoption,Diamond industry and trade regulators,Certification scheme to prevent conflict diamonds from entering mainstream market,Kimberley Process,https://www.kimberleyprocess.org/,Kimberley Process official site,Expanded from Kimberley Process for critical domain coverage
EX-FSC-FM-2022,Standard,Environment & Natural Systems,Extractive Industries & Natural Resources,Forest management,FSC Forest Management Standard,FSC FM,FSC FM 2022,Forest Stewardship Council,NGO,International,Global,2022,1994,Active,Voluntary-with-regulatory-adoption,Forest managers and certification bodies,Principles and criteria for responsible forest management,FSC Forest Management Standard,https://fsc.org/en/certification,Forest Stewardship Council,Expanded from FSC for critical domain coverage
EX-RSPO-2018,Standard,Environment & Natural Systems,Extractive Industries & Natural Resources,Palm oil sustainability,RSPO Principles and Criteria,RSPO P&C,RSPO P&C 2018,Roundtable on Sustainable Palm Oil,Industry SDO,International,Global,2018,2004,Active,Voluntary-with-regulatory-adoption,Palm oil producers and buyers,Standard for sustainable palm oil production,RSPO Principles and Criteria,https://www.rspo.org/certification/principles-and-certification,Roundtable on Sustainable Palm Oil,Expanded from RSPO for critical domain coverage
EX-IRMA-2021,Standard,Environment & Natural Systems,Extractive Industries & Natural Resources,Mining responsibility,IRMA Standard for Responsible Mining,IRMA Standard,IRMA Standard 2021,Initiative for Responsible Mining Assurance,NGO,International,Global,2021,2018,Active,Voluntary-with-regulatory-adoption,Mining companies and stakeholders,Comprehensive standard for responsible mining practice,IRMA Standard for Responsible Mining,https://www.responsiblemining.net/,Initiative for Responsible Mining Assurance,Expanded from IRMA for critical domain coverage
