sigma_id,entry_type,meta_layer,domain,sub_domain,name_full,name_short,standard_id,issuer,issuer_type,governance_layer,geographic_scope,year_published,year_first,status,mandate,sector_applicability,why_it_matters,key_outputs,official_url,data_source,notes
ICT-ETSI-EN300328,Standard,Technology & Infrastructure,Information & Communications Technology (ICT),Radio spectrum access,Wideband transmission systems operating in the 2.4 GHz band,EN 300 328,ETSI EN 300 328,European Telecommunications Standards Institute,Industry SDO,Regional,Europe with global adoption,2019,2001,Active,Voluntary-with-regulatory-adoption,Radio equipment vendors laboratories market surveillance authorities and wireless device manufacturers,Defines harmonised radio requirements for wideband data transmission equipment in the 2.4 GHz ISM band supporting RED conformity assessment,2.4 GHz wideband transmission harmonised standard,https://www.etsi.org/deliver/etsi_en/300300_300399/300328/02.02.02_60/en_300328v020202p.pdf,ETSI official deliverable PDF,ETSI deliverable repository provides EN 300 328 V2.2.2
ICT-ETSI-EN301549,Standard,Technology & Infrastructure,Information & Communications Technology (ICT),ICT accessibility,Accessibility requirements for ICT products and services,EN 301 549,ETSI EN 301 549,European Telecommunications Standards Institute,Industry SDO,Regional,Europe with global adoption,2021,2014,Active,Voluntary-with-regulatory-adoption,Public-sector websites mobile applications ICT procurement product vendors and accessibility auditors,Provides the harmonised European accessibility requirements for ICT products and services including web software hardware and telecommunications functions,ICT accessibility requirements,https://www.etsi.org/human-factors-accessibility/en-301-549-v3-the-harmonized-european-standard-for-ict-accessibility,ETSI official accessibility standard page,ETSI describes EN 301 549 as a harmonised European Standard for ICT accessibility
ICT-ETSI-EN3026372,Standard,Technology & Infrastructure,Information & Communications Technology (ICT),Intelligent transport systems,Intelligent Transport Systems - Vehicular Communications - Basic Set of Applications - Part 2: Specification of Cooperative Awareness Basic Service,EN 302 637-2,ETSI EN 302 637-2,European Telecommunications Standards Institute,Industry SDO,Regional,Europe with global adoption,2019,2010,Active,Voluntary-with-regulatory-adoption,Connected vehicles roadside units ITS stations and transport infrastructure operators,Defines cooperative awareness message services used by connected vehicle and intelligent transport systems,Cooperative Awareness Basic Service specification,https://www.etsi.org/deliver/etsi_en/302600_302699/30263702/01.04.01_60/en_30263702v010401p.pdf,ETSI official deliverable PDF,ETSI deliverable repository provides EN 302 637-2 V1.4.1
ICT-ETSI-EN303645,Standard,Technology & Infrastructure,Information & Communications Technology (ICT),Consumer IoT cybersecurity,Cyber Security for Consumer Internet of Things: Baseline Requirements,EN 303 645,ETSI EN 303 645,European Telecommunications Standards Institute,Industry SDO,Regional,Europe with global adoption,2024,2019,Active,Voluntary-with-regulatory-adoption,Consumer IoT manufacturers certifiers regulators and product security teams,Defines baseline cybersecurity and data protection provisions for consumer IoT devices and associated services,Consumer IoT cybersecurity baseline,https://www.etsi.org/deliver/etsi_en/303600_303699/303645/03.01.03_60/en_303645v030103p.pdf,ETSI official deliverable PDF,ETSI deliverable repository provides EN 303 645 V3.1.3 after original TS publication
ICT-ETSI-NFV-SOL003,Standard,Technology & Infrastructure,Information & Communications Technology (ICT),Network functions virtualization,NFV descriptors based on YANG Specification,SOL003,ETSI GS NFV-SOL 003,European Telecommunications Standards Institute,Industry SDO,Regional,Europe with global adoption,2025,2017,Active,Voluntary,Telecom cloud operators NFV vendors orchestrator developers and interoperability testers,Defines key NFV SOL interface and descriptor material used for network service lifecycle interoperability,NFV SOL003 specification,https://www.etsi.org/deliver/etsi_gs/NFV-SOL/001_099/003/05.03.01_60/gs_nfv-sol003v050301p.pdf,ETSI official deliverable PDF,ETSI deliverable repository lists NFV-SOL 003 versions through V5.3.1
ICT-ETSI-TS103701,Standard,Technology & Infrastructure,Information & Communications Technology (ICT),Consumer IoT cybersecurity assessment,Cyber Security for Consumer Internet of Things: Conformance Assessment of Baseline Requirements,TS 103 701,ETSI TS 103 701,European Telecommunications Standards Institute,Industry SDO,Regional,Europe with global adoption,2025,2021,Active,Voluntary,Consumer IoT test laboratories certification schemes manufacturers and conformity assessment bodies,Provides conformance assessment methodology and test scenarios for ETSI consumer IoT cybersecurity baseline requirements,Consumer IoT cybersecurity conformance assessment,https://www.etsi.org/deliver/etsi_ts/103700_103799/103701/02.01.01_60/ts_103701v020101p.pdf,ETSI official deliverable PDF,ETSI deliverable repository provides TS 103 701 V2.1.1
ICT-ETSI-TS123501,Standard,Technology & Infrastructure,Information & Communications Technology (ICT),5G system architecture,System architecture for the 5G System,TS 123 501,ETSI TS 123 501,European Telecommunications Standards Institute,Industry SDO,Regional,Europe with global adoption,2026,2017,Active,Voluntary-with-regulatory-adoption,Mobile network operators equipment vendors 5G core implementers and interoperability testers,Publishes the ETSI/3GPP system architecture specification for 5G networks and services,5G system architecture specification,https://www.etsi.org/deliver/etsi_ts/123500_123599/123501/18.12.00_60/ts_123501v181200p.pdf,ETSI official deliverable PDF,ETSI deliverable repository provides TS 123 501 Release 18 V18.12.0
