sigma_id,entry_type,meta_layer,domain,sub_domain,name_full,name_short,standard_id,issuer,issuer_type,governance_layer,geographic_scope,year_published,year_first,status,mandate,sector_applicability,why_it_matters,key_outputs,official_url,data_source,notes
HM-CHS-2024,Standard,"Society, Governance & Law",Humanitarian & Emergency Response,Quality and accountability,Core Humanitarian Standard on Quality and Accountability,CHS,CHS 2024,"CHS Alliance, Groupe URD and Sphere",NGO,International,Global,2024,2014,Active,Voluntary,Humanitarian and development organisations,Defines commitments for quality accountability and people-centred humanitarian action,Core Humanitarian Standard 2024,https://www.corehumanitarianstandard.org/,Core Humanitarian Standard official site,Phase 2C curated priority record
HM-IASC-MHPSS-2007,Guideline,"Society, Governance & Law",Humanitarian & Emergency Response,Mental health and psychosocial support,IASC Guidelines on Mental Health and Psychosocial Support in Emergency Settings,IASC MHPSS Guidelines,IASC MHPSS 2007,Inter-Agency Standing Committee,Intergovernmental,International,Global,2007,2007,Active,Voluntary,Humanitarian responders and health protection actors,Provides inter-agency guidance for mental health and psychosocial support across emergency response sectors,IASC MHPSS guidelines,https://www.who.int/publications/i/item/iasc-guidelines-for-mental-health-and-psychosocial-support-in-emergency-settings,WHO official publication page for IASC guidelines,Phase 2C curated priority record
HM-INEE-MS-2024,Standard,"Society, Governance & Law",Humanitarian & Emergency Response,Education in emergencies,INEE Minimum Standards for Education: Preparedness Response Recovery,INEE Minimum Standards,INEE MS 2024,Inter-agency Network for Education in Emergencies,NGO,International,Global,2024,2004,Active,Voluntary,Education cluster partners ministries and humanitarian responders,Defines minimum standards and guidance for quality education preparedness response and recovery in crises,INEE Minimum Standards 2024,https://inee.org/minimum-standards,INEE official minimum standards page,Phase 2C curated priority record
HM-UNHCR-EMERGENCY-HANDBOOK-2015,Framework,"Society, Governance & Law",Humanitarian & Emergency Response,Refugee emergency operations,UNHCR Emergency Handbook,UNHCR Emergency Handbook,UNHCR Emergency Handbook,United Nations High Commissioner for Refugees,UN Agency,International,Global,2015,1982,Active,Voluntary-with-regulatory-adoption,UNHCR staff partners and refugee emergency responders,Provides operational standards and practical guidance for refugee emergency preparedness and response,UNHCR Emergency Handbook,https://emergency.unhcr.org/,UNHCR official Emergency Handbook,Phase 2C curated priority record
HM-WHO-EMT-MIN-2021,Standard,"Society, Governance & Law",Humanitarian & Emergency Response,Emergency medical teams,Classification and minimum standards for emergency medical teams,WHO EMT minimum standards,ISBN 9789240029330,World Health Organization,UN Agency,International,Global,2021,2013,Active,Voluntary-with-regulatory-adoption,Emergency medical teams ministries of health and health emergency coordinators,Defines classification and minimum standards for emergency medical teams responding to disasters outbreaks and other emergencies,Classification and minimum standards for emergency medical teams,https://www.who.int/publications/i/item/9789240029330,WHO official publication page,Phase 2C curated priority record
