sigma_id,entry_type,meta_layer,domain,sub_domain,name_full,name_short,standard_id,issuer,issuer_type,governance_layer,geographic_scope,year_published,year_first,status,mandate,sector_applicability,why_it_matters,key_outputs,official_url,data_source,notes
ICT-W3C-DCAT3,Standard,Technology & Infrastructure,Information & Communications Technology (ICT),Data catalog interoperability,Data Catalog Vocabulary (DCAT) - Version 3,DCAT 3,DCAT Version 3,World Wide Web Consortium,Industry SDO,International,Global,2024,2014,Active,Voluntary-with-regulatory-adoption,Open data portals catalogues metadata platforms and data exchange systems,Defines interoperable metadata vocabulary for describing datasets data services and catalogues on the Web,Data catalog vocabulary,https://www.w3.org/TR/vocab-dcat-3/,W3C Technical Reports standards index,Listed by W3C as a Standard in the Technical Reports standards view
ICT-W3C-GEOLOCATION,Standard,Technology & Infrastructure,Information & Communications Technology (ICT),Web APIs,Geolocation API,Geolocation API,Geolocation API,World Wide Web Consortium,Industry SDO,International,Global,2025,2008,Active,Voluntary-with-regulatory-adoption,Browsers web applications mobile applications and location-aware services,Defines a standard browser API for obtaining user-consented device location information,Web geolocation API,https://www.w3.org/TR/geolocation/,W3C Technical Reports standards index,Listed by W3C as a Standard in the Technical Reports standards view
ICT-W3C-PNG3,Standard,Technology & Infrastructure,Information & Communications Technology (ICT),Graphics and image formats,Portable Network Graphics (PNG) Specification (Third Edition),PNG Third Edition,PNG Specification Third Edition,World Wide Web Consortium,Industry SDO,International,Global,2025,1996,Active,Voluntary-with-regulatory-adoption,Browsers graphics tools publishing systems and image processing applications,Defines the widely implemented lossless PNG image format used across web and digital publishing systems,PNG image format specification,https://www.w3.org/TR/png-3/,W3C Technical Reports standards index,Listed by W3C as a Standard in the Technical Reports standards view
ICT-W3C-VC-DATA-MODEL-2,Standard,Technology & Infrastructure,Information & Communications Technology (ICT),Verifiable credentials,Verifiable Credentials Data Model v2.0,VC Data Model 2.0,Verifiable Credentials Data Model v2.0,World Wide Web Consortium,Industry SDO,International,Global,2025,2019,Active,Voluntary-with-regulatory-adoption,Digital identity wallets credential issuers verifiers and trust frameworks,Defines a standard data model for expressing cryptographically verifiable digital credentials,Verifiable credentials data model,https://www.w3.org/TR/vc-data-model-2.0/,W3C Technical Reports standards index,Listed by W3C as a Standard in the Technical Reports standards view
ICT-W3C-WCAG21,Standard,Technology & Infrastructure,Information & Communications Technology (ICT),Web accessibility,Web Content Accessibility Guidelines (WCAG) 2.1,WCAG 2.1,WCAG 2.1,World Wide Web Consortium,Industry SDO,International,Global,2025,2018,Active,Voluntary-with-regulatory-adoption,Websites apps procurement accessibility policies and digital service compliance,Defines testable accessibility success criteria widely referenced by public-sector and private-sector digital accessibility rules,Accessibility guidelines,https://www.w3.org/TR/WCAG21/,W3C Technical Reports standards index,Listed by W3C as a Standard in the Technical Reports standards view
ICT-W3C-WCAG22,Standard,Technology & Infrastructure,Information & Communications Technology (ICT),Web accessibility,Web Content Accessibility Guidelines (WCAG) 2.2,WCAG 2.2,WCAG 2.2,World Wide Web Consortium,Industry SDO,International,Global,2024,2023,Active,Voluntary-with-regulatory-adoption,Websites apps procurement accessibility policies and digital service compliance,Updates WCAG accessibility requirements with additional success criteria for more inclusive digital services,Accessibility guidelines,https://www.w3.org/TR/WCAG22/,W3C Technical Reports standards index,Listed by W3C as a Standard in the Technical Reports standards view
ICT-W3C-WEBRTC,Standard,Technology & Infrastructure,Information & Communications Technology (ICT),Real-time communications,WebRTC: Real-Time Communication in Browsers,WebRTC,WebRTC: Real-Time Communication in Browsers,World Wide Web Consortium,Industry SDO,International,Global,2025,2021,Active,Voluntary-with-regulatory-adoption,Browsers video conferencing telehealth collaboration and real-time communication services,Defines browser APIs for interoperable real-time audio video and data communication,Real-time communication API,https://www.w3.org/TR/webrtc/,W3C Technical Reports standards index,Listed by W3C as a Standard in the Technical Reports standards view
ICT-W3C-WOFF2,Standard,Technology & Infrastructure,Information & Communications Technology (ICT),Web fonts,WOFF File Format 2.0,WOFF 2.0,WOFF File Format 2.0,World Wide Web Consortium,Industry SDO,International,Global,2024,2018,Active,Voluntary-with-regulatory-adoption,Browsers type foundries publishers design systems and web developers,Defines compressed interoperable font packaging for efficient Web font delivery,Web font file format,https://www.w3.org/TR/WOFF2/,W3C Technical Reports standards index,Listed by W3C as a Standard in the Technical Reports standards view
